Claim,Risk Score,Cluster
"1. **Vaccines and Autism**: ""There was a 1135% greater or elevated risk for an Autism diagnosis among the kids who'd gotten the hepatitis B vaccine within their first month of life.""",10,Cluster 1
"5. **Autism and Vaccines**: A specific study (Simpsonwood meeting transcript) and claims regarding the onset of the autism epidemic coinciding with changes in the vaccine schedule around 1989 are cited, suggesting a potential link between increased vaccine doses and autism prevalence.",10,Cluster 5
"   - Claim: Vaccines are debated in regard to causing autism, with the suggestion that the science supporting their safety and efficacy might not be as solid as presented.",10,Cluster 5
"8. **Ivermectin and Hydroxychloroquine**: The narrative suggests that these drugs were discredited to maintain vaccine eligibility for emergency use authorization, implicating financial motives behind promoting vaccines over these drugs.",10,Cluster 25
"8. **Vaccine-Induced Immune System Damage**: Reference is made to a general belief or claim within the transcript that certain vaccines may exacerbate or cause underlying immune system issues, leading to an increased susceptibility to various diseases.",9,Cluster 5
"1. **Mercury Toxicity in Vaccines**: Ethyl mercury (in vaccines) is claimed to cross the blood-brain barrier more easily than methyl mercury (in fish), leading to more severe neurological inflammation.",8,Cluster 1
"6. **Mercury Disappearance in Blood**: A study by Piero is referenced, which found that ethyl mercury from vaccines disappears from children's blood faster than methyl mercury from fish, yet concerns are raised about where that mercury goes, referring to another study by Thomas Burbacher indicating that ethyl mercury migrates to and persists in the brain.",8,Cluster 1
"2. **Vaccine Safety Testing**: It's claimed that no vaccine out of the 72 doses required for children's school attendance has been tested in a pre-licensing placebo-controlled trial focusing on safety.",8,Cluster 2
"2. **Vaccine Side Effects**: The claim that more vaccines someone receives, the more likely they are to get sick, suggesting vaccinated individuals have higher rates of illness.",8,Cluster 2
"3. **Effectiveness vs. Necessity of Vaccination**: The claim is made that the significant reduction in deaths from infectious diseases in the 20th century was due more to improvements in sanitation, nutrition, and living conditions than to vaccinations.",8,Cluster 3
"4. **Effectiveness and Safety of Vaccines**:",8,Cluster 3
"4. **DTP Vaccine Study in Guinea-Bissau**: A study is mentioned where vaccinated children, particularly girls, were found to have a higher mortality rate from diseases other than diphtheria, tetanus, and pertussis compared to unvaccinated children, suggesting potential immune system compromise.",8,Cluster 4
"7. **Immunological Effects of the DTP Vaccine**: The ""Morganson"" study is cited, claiming that the DTP vaccine was associated with an increased mortality rate for other diseases in vaccinated African children, suggesting an adverse effect on the immune system.",8,Cluster 4
"9. **Legislation and Liability Protection for Vaccine Manufacturers**: The 1986 National Childhood Vaccine Injury Act is mentioned, providing vaccine manufacturers with immunity from liability for vaccine injuries, a legislative change linked to the explosion in the number and types of vaccines.",8,Cluster 6
"10. **Reporting and Prevalence of Vaccine Injuries**: The Lazarus study is mentioned, indicating that actual incidents of vaccine injuries could be significantly higher than officially reported, challenging the official CDC estimates.",8,Cluster 7
"3. **Cell Phone Radiation and Health Risks**: ""Wi-Fi radiation opens up your blood brain barrier...causes cancer... glioblastomas...aluminum...neurotoxic.""",8,Cluster 11
"6. **Mitochondrial Damage Due to Wi-Fi**: ""I think it degrades your mitochondria and...opens your blood-brain barrier.""",8,Cluster 11
"4. **Chronic Disease Epidemic**: ""In 1960s...6% of Americans had chronic disease...by 2006, 54% [of children]...have to be on medication their whole lives.""",8,Cluster 13
"**1. Chronic Disease in Children**: More than 54% of children now have chronic diseases.",8,Cluster 13
"**2. US COVID-19 Mortality and Chronic Disease**: The US, with 4.2% of the global population, had 16% of the COVID deaths, atributed partially to the prevalent burden of chronic disease in the country.",8,Cluster 13
"5. **Environmental Toxins and Health**: ""Our children are swimming around in a toxic soup...it has to come from a toxic exposure...glyphosate, neonicotinoid pesticides, PFOAs.""",8,Cluster 14
"    - No specific source mentioned regarding Wi-Fi's impact on mitochondria and the blood-brain barrier.",8,Cluster 15
"**4. Glyphosate Presence in Americans**: A study showed that an enormous percentage of Americans, in the 90% range, have glyphosate in their blood.",8,Cluster 16
"**5. Roundup (Glyphosate) and Disease Linkage**: Roundup, or glyphosate, is linked to many diseases including non-alcoholic fatty liver, cancers, kidney diseases, and damage to the microbiome.",8,Cluster 16
"**9. Atrazine and Amphibian Sexual Development**: Exposure to atrazine in water can lead to chemical castration and sex reversal in frogs.",8,Cluster 18
"**10. Microplastics and Reproductive Effects**: Microplastics, along with substances like atrazine, are having effects on human reproductive systems.",8,Cluster 18
"1. **Vaccine Efficacy**: The vaccine's efficacy wanes into negative efficacy after 7 months, suggesting those vaccinated are more likely to get sick compared to the unvaccinated.",8,Cluster 20
"3. **Nutritional Deficiencies and Immune System**: It's claimed that vitamin D deficiency was prevalent in over 90% of ICU admittances due to COVID-19, emphasizing the importance of nutrition in immune system support.",8,Cluster 21
"4. **Spanish Flu Origin**: The Spanish Flu was suggested to be caused by bacterial pneumonia, not a virus, and it's insinuated that vaccine testing may have contributed to its spread.",8,Cluster 22
"5. **Adverse Reactions to Pharmaceuticals**: The claim includes specific examples like the controversial drug AZT for AIDS treatment, suggesting it was harmful or lethal to patients.",8,Cluster 23
"6. **Drug Approval and Regulation**: Assertions about the regulatory and approval processes being influenced by pharmaceutical companies' financial interests, particularly focusing on the emergency use authorization conditions and the role of the FDA and NIH.",8,Cluster 23
"7. **COVID-19 Vaccine Trial Data**: Specific data from Pfizer's trial is mentioned, highlighting an analysis that suggests vaccinating 22,000 people would save one life while potentially increasing the risk of death due to the vaccine.",8,Cluster 24
"   - Claim: Pharmaceutical drugs are the number three killer in the country, following cancer and heart attacks.",8,Cluster 27
"2. **Relative Risk and Causation**: ""A relative risk of two is considered proof of causation as long as there's biological plausibility.""",7,Cluster 10
"    - Source mentioned: Personal representation of individuals with cell phone tumors, and litigation against FCC and FDA.",7,Cluster 12
"**7. GMO Corn and Glyphosate Use**: By 95% of corn in the United States became Roundup Ready, allowing for aerial application of glyphosate over crops.",7,Cluster 16
"9. **Media and Public Response**: Claiming a bias in media reporting and public discourse that discourages discussion of vaccine concerns and promotes a unilateral pro-vaccine narrative at the expense of open scientific dialogue.",7,Cluster 26
"   - Claim: Pharmaceutical advertising on television is partly responsible for Americans taking three to four times the amount of drugs as Europeans.",7,Cluster 27
"3. **Impact of Pharmaceutical Advertising on Healthcare Costs and Outcomes**:",7,Cluster 27
"   - Claim: Despite spending more on healthcare than any other country, the United States has the worst health outcomes, lagging behind countries like Mongolia, Costa Rica, and Cuba.",7,Cluster 29
"   - Claim: The U.S. spends 1.3 trillion on military and national security, impacting the availability of funds for domestic welfare like healthcare and education.",7,Cluster 29
"5. **U.S. Military Expenditures and Impact on Domestic Welfare**:",7,Cluster 30
"6. **Economic Impact of Pharmaceutical Advertising Regulation Changes in 1997**:",7,Cluster 31
"    - Source mentioned: Ver Raden's analysis within HMO databases.",5,Cluster 9
"Given the complexity and length of the provided transcript, which spans several wide-ranging topics and numerous claims, a complete dissection of every claim is beyond the scope of a single response. However, I will identify several key claims mentioned in the transcript, focusing on those with scientific or technical nature that stand out due to either their specificity or potential for significant impact. It's important to note that the claims listed here require further investigation and verification from credible sources and should not be taken at face value.",5,Cluster 19
"**6. Glyphosate as an Original Tank Scalant**: Glyphosate was originally developed as a tank scalant before being repurposed as an herbicide by Monsanto.",3,Cluster 17
"For accurate verification and context, it's essential to consult the original studies, reviews, and the latest scientific data available in peer-reviewed journals and official public health statements.",1,Cluster 8
"Remember, the presence of a claim in public discourse, regardless of the source, necessitates careful scrutiny through peer-reviewed scientific evidence and expert analysis before being considered as validated information.",1,Cluster 8
